<?xml version="1.0"?>

<auditorResources xmlns:xsi="http://www.w3.org/2001/XMLSchema-instance"
                  xsi:noNamespaceSchemaLocation="auditorResources.xsd">
	<auditor id="default" level="debug" default="true">
		<appenders>
			<appender class="br.com.concepting.framework.audit.appenders.ConsoleAuditorAppender">
				<options>
					<option id="layoutClass" value="br.com.concepting.framework.audit.appenders.AuditorPatternLayout"/>
					<option id="layoutPattern" value="[#{createDate}][#{systemModule}][#{userName}][#{systemSession.ip}/#{systemSession.hostName}][#{entityId} - #{businessId}] #{businessComplement} -> #{statusCode} #{statusMessage}"/>
				</options>
			</appender>
		</appenders>
	</auditor>
	<auditor id="generate.code" level="info">
		<appenders>
			<appender class="br.com.concepting.framework.audit.appenders.ConsoleAuditorAppender">
				<options>
					<option id="layoutClass" value="br.com.concepting.framework.audit.appenders.AuditorPatternLayout"/>
					<option id="layoutPattern" value="[#{createDate}][#{businessId}] #{businessComplement} -> #{statusCode} #{statusMessage}"/>
				</options>
			</appender>
		</appenders>
	</auditor>
</auditorResources>